{
  "schema": "agentcut.shot_recipe_registry.v1",
  "registry_id": "agentcut.short_drama.director_recipes",
  "version": "1.0.0",
  "source": {
    "repository": "https://github.com/Vincentwei1021/video-shotcraft",
    "commit": "d4915443232e89527fdc9d7e79f132ba411fc440"
  },
  "license": {
    "spdx": "Apache-2.0",
    "notice": "NOTICE"
  },
  "selection_policy": {
    "target": "live-action and generated short drama",
    "ui_only_default": false,
    "remotion_dependency": false,
    "audio_assets_imported": false,
    "layer": "per_shot_director_execution",
    "style_template_behavior": "preserve_project_style",
    "style_override_allowed": false
  },
  "recipes": [
    {
      "schema": "agentcut.shot_recipe.v1",
      "recipe_id": "camera.slow_push_in",
      "version": "1.0.0",
      "source": {
        "repository": "https://github.com/Vincentwei1021/video-shotcraft",
        "commit": "d4915443232e89527fdc9d7e79f132ba411fc440",
        "path": "references/shots/camera/tension-camera-moves.md",
        "adaptation": "structure and motion-language study; no Remotion code or media copied"
      },
      "license": {
        "spdx": "Apache-2.0",
        "notice": "NOTICE",
        "audio_included": false
      },
      "dramatic_intent": "Slow push-in that accumulates pressure before a decisive cut.",
      "applicability": {
        "media_kinds": [
          "live_action",
          "generated_short_drama",
          "hybrid"
        ],
        "ui_only": false,
        "default_short_drama_registry": true
      },
      "energy_before": 0.25,
      "energy_after": 0.72,
      "suggested_duration": {
        "min_seconds": 2.5,
        "target_seconds": 4.0,
        "max_seconds": 5.5
      },
      "camera_motion": {
        "type": "slow_push_in",
        "direction": "forward",
        "intensity": 0.72
      },
      "motion_arc": {
        "phases": [
          {
            "phase_id": "setup",
            "start_ratio": 0.0,
            "end_ratio": 0.22,
            "description": "establish subject and causal setup",
            "camera_state": {
              "energy": 0.25
            }
          },
          {
            "phase_id": "contact",
            "start_ratio": 0.22,
            "end_ratio": 0.72,
            "description": "execute the named camera/action contact",
            "camera_state": {
              "energy": 0.72
            }
          },
          {
            "phase_id": "result",
            "start_ratio": 0.72,
            "end_ratio": 1.0,
            "description": "hold the changed state long enough to read",
            "camera_state": {
              "energy": 0.72
            }
          }
        ]
      },
      "subject_anchor": {
        "x_ratio": 0.5,
        "y_ratio": 0.46,
        "tolerance_ratio": 0.18,
        "safe_for_9x16": true
      },
      "action": {
        "setup": "establish a readable pre-action state",
        "contact": "show the decisive physical or editorial contact",
        "result": "show a visibly changed state"
      },
      "planned_hold": {
        "windows": [
          {
            "phase_id": "result_read",
            "hold_id": "result_read",
            "start_ratio": 0.82,
            "end_ratio": 1.0,
            "reason": "result readability"
          }
        ]
      },
      "transition_intent": {
        "kind": "within_shot",
        "intentional_black": null
      },
      "beat_anchor": {
        "phase_id": "contact",
        "semantic": "tension_peak"
      },
      "sfx_cues": [
        {
          "cue_id": "primary_contact",
          "semantic": "editorial contact accent",
          "phase_id": "contact",
          "offset_seconds": 0,
          "asset_path": null,
          "license": null,
          "license_status": "symbolic_only"
        }
      ],
      "known_pitfalls": [
        "do not use the recipe to excuse missing story information",
        "do not stack another recipe with the same dominant motion family on the same clip",
        "review normal-speed playback; still-frame novelty is not acceptance"
      ],
      "qa_contract": {
        "required_checks": [
          "source_admission",
          "narrative_gate",
          "cadence",
          "black_frame",
          "dialogue_coverage",
          "audio_safety"
        ],
        "reject_unmotivated_hold": true,
        "preserve_existing_hard_gates": true
      },
      "rollback": {
        "strategy": "remove the shot_recipe reference or restore the prior clip metadata, then recompile and rerender",
        "source_media_modified": false,
        "platform_mutation_authorized": false
      }
    },
    {
      "schema": "agentcut.shot_recipe.v1",
      "recipe_id": "camera.pull_back_isolation",
      "version": "1.0.0",
      "source": {
        "repository": "https://github.com/Vincentwei1021/video-shotcraft",
        "commit": "d4915443232e89527fdc9d7e79f132ba411fc440",
        "path": "references/shots/camera/tension-camera-moves.md",
        "adaptation": "structure and motion-language study; no Remotion code or media copied"
      },
      "license": {
        "spdx": "Apache-2.0",
        "notice": "NOTICE",
        "audio_included": false
      },
      "dramatic_intent": "Pull back to isolate one subject as surrounding context falls away.",
      "applicability": {
        "media_kinds": [
          "live_action",
          "generated_short_drama",
          "hybrid"
        ],
        "ui_only": false,
        "default_short_drama_registry": true
      },
      "energy_before": 0.5,
      "energy_after": 0.18,
      "suggested_duration": {
        "min_seconds": 3.0,
        "target_seconds": 4.5,
        "max_seconds": 6.0
      },
      "camera_motion": {
        "type": "pull_back",
        "direction": "backward",
        "intensity": 0.5
      },
      "motion_arc": {
        "phases": [
          {
            "phase_id": "setup",
            "start_ratio": 0.0,
            "end_ratio": 0.22,
            "description": "establish subject and causal setup",
            "camera_state": {
              "energy": 0.5
            }
          },
          {
            "phase_id": "contact",
            "start_ratio": 0.22,
            "end_ratio": 0.72,
            "description": "execute the named camera/action contact",
            "camera_state": {
              "energy": 0.5
            }
          },
          {
            "phase_id": "result",
            "start_ratio": 0.72,
            "end_ratio": 1.0,
            "description": "hold the changed state long enough to read",
            "camera_state": {
              "energy": 0.18
            }
          }
        ]
      },
      "subject_anchor": {
        "x_ratio": 0.5,
        "y_ratio": 0.46,
        "tolerance_ratio": 0.18,
        "safe_for_9x16": true
      },
      "action": {
        "setup": "establish a readable pre-action state",
        "contact": "show the decisive physical or editorial contact",
        "result": "show a visibly changed state"
      },
      "planned_hold": {
        "windows": [
          {
            "phase_id": "result_read",
            "hold_id": "result_read",
            "start_ratio": 0.82,
            "end_ratio": 1.0,
            "reason": "result readability"
          }
        ]
      },
      "transition_intent": {
        "kind": "within_shot",
        "intentional_black": null
      },
      "beat_anchor": {
        "phase_id": "contact",
        "semantic": "isolation_result"
      },
      "sfx_cues": [
        {
          "cue_id": "primary_contact",
          "semantic": "editorial contact accent",
          "phase_id": "contact",
          "offset_seconds": 0,
          "asset_path": null,
          "license": null,
          "license_status": "symbolic_only"
        }
      ],
      "known_pitfalls": [
        "do not use the recipe to excuse missing story information",
        "do not stack another recipe with the same dominant motion family on the same clip",
        "review normal-speed playback; still-frame novelty is not acceptance"
      ],
      "qa_contract": {
        "required_checks": [
          "source_admission",
          "narrative_gate",
          "cadence",
          "black_frame",
          "dialogue_coverage",
          "audio_safety"
        ],
        "reject_unmotivated_hold": true,
        "preserve_existing_hard_gates": true
      },
      "rollback": {
        "strategy": "remove the shot_recipe reference or restore the prior clip metadata, then recompile and rerender",
        "source_media_modified": false,
        "platform_mutation_authorized": false
      }
    },
    {
      "schema": "agentcut.shot_recipe.v1",
      "recipe_id": "camera.dutch_roll_to_level",
      "version": "1.0.0",
      "source": {
        "repository": "https://github.com/Vincentwei1021/video-shotcraft",
        "commit": "d4915443232e89527fdc9d7e79f132ba411fc440",
        "path": "references/shots/camera/tension-camera-moves.md",
        "adaptation": "structure and motion-language study; no Remotion code or media copied"
      },
      "license": {
        "spdx": "Apache-2.0",
        "notice": "NOTICE",
        "audio_included": false
      },
      "dramatic_intent": "Roll an unstable frame back to level to mark correction or regained control.",
      "applicability": {
        "media_kinds": [
          "live_action",
          "generated_short_drama",
          "hybrid"
        ],
        "ui_only": false,
        "default_short_drama_registry": true
      },
      "energy_before": 0.62,
      "energy_after": 0.42,
      "suggested_duration": {
        "min_seconds": 2.0,
        "target_seconds": 3.5,
        "max_seconds": 5.0
      },
      "camera_motion": {
        "type": "dutch_roll",
        "direction": "clockwise_to_level",
        "intensity": 0.62
      },
      "motion_arc": {
        "phases": [
          {
            "phase_id": "setup",
            "start_ratio": 0.0,